<!-- 
XML (eXtensible Markup Language) is used primarily for storing and transporting data in a structured format that is both human-readable and machine-readable. Some common uses of XML include:

Data Exchange: XML provides a standardized format for exchanging data between different systems and platforms. It's commonly used in web services, APIs, and data integration scenarios.

Configuration Files: Many software applications use XML for configuration files due to its structured nature and ease of parsing.

Document Storage: XML is used for storing structured documents where hierarchical data representation is required, such as in content management systems.

Web Services: XML-based protocols like SOAP (Simple Object Access Protocol) use XML for message exchange between applications over networks.

Data Interchange Formats: XML is often used as a data interchange format between databases and applications, enabling interoperability. -->

<!-- Example of XML with Simple Type and Complex Type Elements:
Here's an example of an XML file (data.xml) containing both simple type and complex type elements: -->

<?xml version="1.0" encoding="UTF-8"?>
<Library>
    <Book>
        <Title>XML and You</Title>
        <Author>John Doe</Author>
        <ISBN>978-1-234567-89-0</ISBN>
        <Price>29.99</Price>
    </Book>
    <Book>
        <Title>Data Structures in XML</Title>
        <Author>Jane Smith</Author>
        <ISBN>978-9-876543-21-0</ISBN>
        <Price>39.99</Price>
    </Book>
</Library>

<!-- Equivalent DTD (Document Type Definition):
DTDs provide a way to define the structure and constraints of an XML document. Here's the equivalent DTD (data.dtd) for the above XML: -->

<!DOCTYPE Library [
    <!ELEMENT Library (Book+)>
    <!ELEMENT Book (Title, Author, ISBN, Price)>
    <!ELEMENT Title (#PCDATA)>
    <!ELEMENT Author (#PCDATA)>
    <!ELEMENT ISBN (#PCDATA)>
    <!ELEMENT Price (#PCDATA)>
    <!ATTLIST Book
        id ID #IMPLIED
    >
]>

<!-- Explanation of DTD:
DOCTYPE: Specifies the document type declaration and the root element (Library in this case).
ELEMENT declarations:
Library is a complex type element containing one or more Book elements ((Book+)).
Book is a complex type element containing Title, Author, ISBN, and Price elements.
ELEMENT declarations for simple type elements:
Title, Author, ISBN, and Price are declared as elements containing parsed character data (#PCDATA).
ATTLIST declaration:
Allows an optional id attribute (ID #IMPLIED) for the Book element.

Usage:
XML (data.xml): Contains actual data in a structured format.
DTD (data.dtd): Defines the structure and constraints of the XML document, ensuring that it adheres 
to the specified format (Library containing one or more Book elements, each with Title, Author, ISBN, and Price).

This combination of XML and DTD provides a clear and structured way to represent and validate data, 
making it suitable for various applications such as data exchange, configuration files, and document storage. -->



